Austria,Nieder­österreich,,10000,no,Max 10000 guests for outdoor events with fixed seats provided this is approved by the locally responsible district administrative authority.,1 September 2020,"""As of September 1, 2020, these numbers will be increased to... 10,000 visitors in the open air""",https://web.archive.org/web/20200901122518/https://www.sozialministerium.at/Informationen-zum-Coronavirus/Coronavirus---Aktuelle-Ma%C3%9Fnahmen.html https://web.archive.org/web/20200910224450/https://www.sozialministerium.at/Informationen-zum-Coronavirus/Coronavirus---Aktuelle-Ma%C3%9Fnahmen.html,13 September 2020,"""For events with assigned and marked seats, the maximum number of people in the open air is 3000.""",https://web.archive.org/web/20200914085401/https://www.sozialministerium.at/Informationen-zum-Coronavirus/Coronavirus---Aktuelle-Ma%C3%9Fnahmen.html, ,5000,no,Max 5000 guests for indoor events with fixed seats provided this is approved by the locally responsible district administrative authority.,1 September 2020,"""As of September 1, 2020, these numbers will be increased to 5,000 visitors in closed rooms""",https://web.archive.org/web/20200901122518/https://www.sozialministerium.at/Informationen-zum-Coronavirus/Coronavirus---Aktuelle-Ma%C3%9Fnahmen.html https://web.archive.org/web/20200910224450/https://www.sozialministerium.at/Informationen-zum-Coronavirus/Coronavirus---Aktuelle-Ma%C3%9Fnahmen.html,13 September 2020,"""For events with assigned and marked  seats in closed rooms, the maximum number of people of 1500 applies.""",https://web.archive.org/web/20200914085401/https://www.sozialministerium.at/Informationen-zum-Coronavirus/Coronavirus---Aktuelle-Ma%C3%9Fnahmen.html, ,10000,no,Max 10000 guests for outdoor events with fixed seats provided this is approved by the locally responsible district administrative authority.,1 September 2020,I can't see anything specific regarding private as opposed to public gatherings in the advice given,https://web.archive.org/web/20200901122518/https://www.sozialministerium.at/Informationen-zum-Coronavirus/Coronavirus---Aktuelle-Ma%C3%9Fnahmen.html https://web.archive.org/web/20200910224450/https://www.sozialministerium.at/Informationen-zum-Coronavirus/Coronavirus---Aktuelle-Ma%C3%9Fnahmen.html,13 September 2020,"""For events with assigned and marked seats, the maximum number of people in the open air is 3000.""",https://web.archive.org/web/20200914085401/https://www.sozialministerium.at/Informationen-zum-Coronavirus/Coronavirus---Aktuelle-Ma%C3%9Fnahmen.html, ,1,1,"Although private gatherings in homes could not be regulated, during hard lockdowns private gatherings in other indoor venues would be banned. In addition functionally due to curfew and hard lockdowns most gatherings in private indoor venues were unlikley to take place during the hard lockdown. As agreed by multiple researchers after discussion with local epidemiologists ",26 December 2020,"See edge case doc: https://docs.google.com/document/d/1fdQIMDP-yeLAnMt3_09GwxyUL5TgsymLnRBxASVR84w/edit and mention of this legal difficulty here, for example: https://www.covid19healthsystem.org/countries/austria/livinghit.aspx?Section=1.2%20Physical%20distancing&Type=Section#3Physicaldistancing",https://web.archive.org/web/20201229144455/https://www.sozialministerium.at/Informationen-zum-Coronavirus/Coronavirus---Aktuelle-Ma%C3%9Fnahmen.html,No,,,,,,,,,,,,,,,,,,,,,,,,,,,,Shops are mostly closed and close-contact services are closed,26 December 2020,"""Trade and services : Shops are generally closed. Only those companies that offer important goods (e.g. food, medicines) are allowed to enter. Customer areas of non-body-oriented service companies (e.g. banks, car workshops, insurance companies, cleaning shops, tailoring shops, etc.) may also be visited.""",https://web.archive.org/web/20201229144455/https://www.sozialministerium.at/Informationen-zum-Coronavirus/Coronavirus---Aktuelle-Ma%C3%9Fnahmen.html https://www.ris.bka.gv.at/Dokumente/BgblAuth/BGBLA_2020_II_598/BGBLA_2020_II_598.html,no,"Advice on government website appears unchanged since 2020/12/26, as of today (2021/01/12). Also ordinance that came into force on 2020/12/26 was amended such that it was extended to run until 2021/01/14.",Archived government advice page: https://archive.vn/dXePU. old ordinance: https://www.ris.bka.gv.at/Dokumente/BgblAuth/BGBLA_2020_II_598/BGBLA_2020_II_598.html. amendment to extend old ordinance: https://www.ris.bka.gv.at/Dokumente/BgblAuth/BGBLA_2021_II_2/BGBLA_2021_II_2.html,,Most things are closed except essential shops etc,26 December 2020,"""Trade and services : Shops are generally closed. Only those companies that offer important goods (e.g. food, medicines) are allowed to enter. Customer areas of non-body-oriented service companies (e.g. banks, car workshops, insurance companies, cleaning shops, tailoring shops, etc.) may also be visited. Companies that offer body-hugging services remain closed (e.g. hairdressers, nail salons, piercing studios, massage studios - exception: medical purposes).""",https://web.archive.org/web/20201229144455/https://www.sozialministerium.at/Informationen-zum-Coronavirus/Coronavirus---Aktuelle-Ma%C3%9Fnahmen.html https://www.ris.bka.gv.at/Dokumente/BgblAuth/BGBLA_2020_II_598/BGBLA_2020_II_598.html,no,"Advice on government website appears unchanged since 2020/12/26, as of today (2021/01/12). Also ordinance that came into force on 2020/12/26 was amended such that it was extended to run until 2021/01/14.",Archived government advice page: https://archive.vn/dXePU. old ordinance: https://www.ris.bka.gv.at/Dokumente/BgblAuth/BGBLA_2020_II_598/BGBLA_2020_II_598.html. amendment to extend old ordinance: https://www.ris.bka.gv.at/Dokumente/BgblAuth/BGBLA_2021_II_2/BGBLA_2021_II_2.html,,Leaving home between 8pm and 6am is only permitted under limited conditions,7 December 2020,"""Leaving the private living area and staying outside the private living area between 8 p.m. and 6 a.m. are only permitted for the following purposes...""",https://web.archive.org/web/20201207170144/https://www.sozialministerium.at/Informationen-zum-Coronavirus/Coronavirus---Aktuelle-Ma%C3%9Fnahmen.html https://www.ris.bka.gv.at/Dokumente/BgblAuth/BGBLA_2020_II_544/BGBLA_2020_II_544.html,23 December 2020,Curfew lifted for 24th and 25th Dec,https://www.ris.bka.gv.at/Dokumente/BgblAuth/BGBLA_2020_II_566/BGBLA_2020_II_566.html https://web.archive.org/web/20201222220659/https://www.sozialministerium.at/Informationen-zum-Coronavirus/Coronavirus---Aktuelle-Ma%C3%9Fnahmen.html,,Autumn break,holidays,27 October 2020,"""Deviations for individual schools or types of schools are possible"", but my understanding is that this should be roughly right.",https://www.bmbwf.gv.at/Themen/schule/schulpraxis/termine/ferientermine_20_21.html,1 November 2020,,https://www.bmbwf.gv.at/Themen/schule/schulpraxis/termine/ferientermine_20_21.html,,Autumn break,holidays,27 October 2020,"""Deviations for individual schools or types of schools are possible"", but my understanding is that this should be roughly right.",https://www.bmbwf.gv.at/Themen/schule/schulpraxis/termine/ferientermine_20_21.html,1 November 2020,,https://www.bmbwf.gv.at/Themen/schule/schulpraxis/termine/ferientermine_20_21.html, ,christmas vacation,24 December 2020,"I couldn't find Christmas holiday dates for any university except FH-St. Poelten. This university has a break from 24 December - 6 Jan. Since this is more or less the latest start and earliest finish for a Christmas holiday break that I've seen so far, it seems reasonable to use these dates here.",https://www.donau-uni.ac.at/en/studies/study-organisation/term-dates.html https://www.fhwn.ac.at/en/international/incomings/academic-calendar https://www.fh-krems.ac.at/studium/bewerbung/termine-und-fristen/ https://www.fhstp.ac.at/en/international/incoming-students/academic-calendar,6 January 2021,"I couldn't find Christmas holiday dates for any university except FH-St. Poelten. This university has a break from 24 December - 6 Jan. Since this is more or less the latest start and earliest finish for a Christmas holiday break that I've seen so far, it seems reasonable to use these dates here.",https://www.donau-uni.ac.at/en/studies/study-organisation/term-dates.html https://www.fhwn.ac.at/en/international/incomings/academic-calendar https://www.fh-krems.ac.at/studium/bewerbung/termine-und-fristen/https://www.fhstp.ac.at/en/international/incoming-students/academic-calendarr,,,,,,3,"Mouth and nose protection to be worn in specified places (shops, public transport, probably most indoor places)",14 September 2020,"""Since September 14th an MNS has to be worn in the following areas: [a long list follows]"". Note that I'm deferring to OXCGRT here since we're using their definitions. It's not especially clear to me that the measures correspond to ""3"" rather than ""2"", but OXCGRT has them as ""3"".",https://web.archive.org/web/20200914085401/https://www.sozialministerium.at/Informationen-zum-Coronavirus/Coronavirus---Aktuelle-Ma%C3%9Fnahmen.html,no,e.g. see OXCGRT data,
Austria,Nieder­österreich,,3000,no,Max 3000 guests for outdoor events with fixed seats,14 September 2020,"""For events with assigned and marked seats, the maximum number of people in the open air is 3000.""",https://web.archive.org/web/20200914085401/https://www.sozialministerium.at/Informationen-zum-Coronavirus/Coronavirus---Aktuelle-Ma%C3%9Fnahmen.html,22 October 2020,"""Public events (such as theater performances and concerts) may take place with a maximum of 1,000 people inside and 1,500 outside""",https://web.archive.org/web/20201023152100/https://orf.at/stories/3185779/, ,1500,no,Max 1500 guests for indoor events with fixed seats,14 September 2020,"""For events with assigned and marked  seats in closed rooms, the maximum number of people of 1500 applies.""",https://web.archive.org/web/20200914085401/https://www.sozialministerium.at/Informationen-zum-Coronavirus/Coronavirus---Aktuelle-Ma%C3%9Fnahmen.html,22 October 2020,"""Public events (such as theater performances and concerts) may take place with a maximum of 1,000 people inside and 1,500 outside""",https://web.archive.org/web/20201023152100/https://orf.at/stories/3185779/, ,3000,no,Max 3000 guests for outdoor events with fixed seats,14 September 2020,I can't see anything specific regarding private as opposed to public gatherings in the advice given,https://web.archive.org/web/20200914085401/https://www.sozialministerium.at/Informationen-zum-Coronavirus/Coronavirus---Aktuelle-Ma%C3%9Fnahmen.html,22 October 2020,"""the federal government presented new corona measures. These will go into effect on Friday... Outdoor meetings are limited to 12 people""",https://web.archive.org/web/20201024060408/https://metropole.at/coronavirus-in-austria/, ,,,,,,,,,,,,,,,,,,,,,,,,,,,,,,,,,,,,,,,,,,,,,,,,,,,,,,,,,,,"Primary schools only open for ""care""",COVID,17 November 2020,"""According to the Department of Education, all schools are expected to switch to distance learning."" ""Kindergartens and compulsory schools will no longer offer lessons, but will offer “care” to children who need it."" The effect on actual behaviour from the government announcement isn't immediately obvious, so the attendance numbers from the vienna.at articles are very useful. See also the explanations doc.","https://www.thelocal.at/20201114/austria-braces-for-hard-lockdown-from-tuesday https://www.vienna.at/grosse-unterschiede-bei-schulbesuch-am-ersten-lockdown-tag/6811795 https://www.vienna.at/wieder-mehr-schueler-in-schulen/6822370#:~:text=Rund%2018%20Prozent%20in%20Wien&text=Wien%20und%20Ober%C3%B6sterreich%20kommen%20auf,die%20wenigsten%20an%20AHS%2DUnterstufen.",6 December 2020,"""Kindergartens and compulsory schools resume regular operations""",https://web.archive.org/web/20201207170144/https://www.sozialministerium.at/Informationen-zum-Coronavirus/Coronavirus---Aktuelle-Ma%C3%9Fnahmen.html,,"Last 5 grades of secondary school on ""distance learning"", though some in-person attendance is possible; first 4 grades of secondary school only open for ""care""",COVID,17 November 2020,"""According to the Department of Education, all schools are expected to switch to distance learning."" ""Kindergartens and compulsory schools will no longer offer lessons, but will offer “care” to children who need it."" The effect on actual behaviour from the government announcement isn't immediately obvious, so the attendance numbers from the vienna.at articles are very useful. See also the explanations doc.","https://www.thelocal.at/20201114/austria-braces-for-hard-lockdown-from-tuesday https://www.vienna.at/grosse-unterschiede-bei-schulbesuch-am-ersten-lockdown-tag/6811795 https://www.vienna.at/wieder-mehr-schueler-in-schulen/6822370#:~:text=Rund%2018%20Prozent%20in%20Wien&text=Wien%20und%20Ober%C3%B6sterreich%20kommen%20auf,die%20wenigsten%20an%20AHS%2DUnterstufen.",6 December 2020,"""Kindergartens and compulsory schools resume regular operations"". Since (as I understand it) 4 of the 9 grades for ages 10+ are compulsory schools and re-opened on 7th Dec, I think we should count the NPI as finished here. See also the explanations doc",https://web.archive.org/web/20201207170144/https://www.sozialministerium.at/Informationen-zum-Coronavirus/Coronavirus---Aktuelle-Ma%C3%9Fnahmen.html https://www.bildungssystem.at/, ,,,,,,,,,,,,,,,,,,,,
Austria,Nieder­österreich,,1500,no,Max 1500 guests for outdoor public events with fixed seats and masks,23 October 2020,"""Public events (such as theater performances and concerts) may take place with a maximum of 1,000 people inside and 1,500 outside""",https://web.archive.org/web/20201023152100/https://orf.at/stories/3185779/,25 October 2020,"At the 2020/10/22 meeting of the corona ampel committee, 21 of the 24 districts in Niederoesterreich became orange or red. Previously, 16 were orange and none were red. I think 21/24 districts is enough to say that most public indoor gatherings in the State were affected. The rules say that at most 1000 people are allowed at outdoor events, except for national or international sport (for which 1500 people are allowed). We think we can consider most events to be limited by the 1000 number. The rules applied to orange or red districts, coming into effect the Monday following the traffic light colour change.",https://web.archive.org/web/20201027152713/https://corona-ampel.gv.at/aktuelle-massnahmen/regionale-zusaetzliche-massnahmen/niederoesterreich/ https://web.archive.org/web/20201023044344/http://www.noe.gv.at/noe/Corona-Sonderregelungen_in_Niederoesterreich.html https://corona-ampel.gv.at/sites/corona-ampel.gv.at/files/inline-files/Kommission%20_20201015_Sitzungsergebnis_bf.pdf https://corona-ampel.gv.at/sites/corona-ampel.gv.at/files/Kommission_20201022_Sitzungsergebnis_bf.pdf https://www.noe.gv.at/noe/Corona_VO_Sonderregelungen_BHWB_Konsolidierung.pdf https://www.noen.at/niederoesterreich/politik/eigene-regeln-bei-orange-noe-verschaerft-corona-massnahmen-lockdown-verhindern-niederoesterreich-corona-corona-ampel-corona-beschraenkungen-corona-cluster-corona-massnahmen-coronavirus-johanna-mikl-leitner-225677283#, ,1000,no,Max 1000 guests for indoor public events with fixed seats and masks,23 October 2020,"""Public events (such as theater performances and concerts) may take place with a maximum of 1,000 people inside and 1,500 outside""",https://web.archive.org/web/20201023152100/https://orf.at/stories/3185779/,25 October 2020,"At the 2020/10/22 meeting of the corona ampel committee, 21 of the 24 districts in Niederoesterreich became orange or red. Previously, 16 were orange and none were red. I think 21/24 districts is enough to say that most public indoor gatherings in the State were affected. The rules say that at most 250 people are allowed at indoor events. The rules applied to orange or red districts, coming into effect the Monday following the traffic light colour change.",https://web.archive.org/web/20201027152713/https://corona-ampel.gv.at/aktuelle-massnahmen/regionale-zusaetzliche-massnahmen/niederoesterreich/ https://web.archive.org/web/20201023044344/http://www.noe.gv.at/noe/Corona-Sonderregelungen_in_Niederoesterreich.html https://corona-ampel.gv.at/sites/corona-ampel.gv.at/files/inline-files/Kommission%20_20201015_Sitzungsergebnis_bf.pdf https://corona-ampel.gv.at/sites/corona-ampel.gv.at/files/Kommission_20201022_Sitzungsergebnis_bf.pdf https://www.noe.gv.at/noe/Corona_VO_Sonderregelungen_BHWB_Konsolidierung.pdf https://www.noen.at/niederoesterreich/politik/eigene-regeln-bei-orange-noe-verschaerft-corona-massnahmen-lockdown-verhindern-niederoesterreich-corona-corona-ampel-corona-beschraenkungen-corona-cluster-corona-massnahmen-coronavirus-johanna-mikl-leitner-225677283#, ,12,no,Max 12 people at outdoor gatherings,23 October 2020,"""the federal government presented new corona measures. These will go into effect on Friday... Outdoor meetings are limited to 12 people""",https://web.archive.org/web/20201024060408/https://metropole.at/coronavirus-in-austria/,2 November 2020,"See § 13. (1)-(3), especially § 13. (3) 8th. ""(1) Events are prohibited... (3) Paragraph 1 does not apply to... 8th. Meetings of no more than six people, although they may only come from two different households, plus their underage children or minors who are subject to supervision, but no more than six minors in total."". For some reason this isn't advertised on the main information page (https://web.archive.org/web/20201109211208/https://www.sozialministerium.at/Informationen-zum-Coronavirus/Coronavirus---Aktuelle-Ma%C3%9Fnahmen.html)",https://www.ris.bka.gv.at/Dokumente/BgblAuth/BGBLA_2020_II_463/BGBLA_2020_II_463.html, ,,,,,,,,,,,,,,,,,,,,,,,,,,,,,,,,,,,,,,,,,,,,,,,,,,,,,,,,,,,Christmas holidays,holidays,24 December 2020,"""Deviations for individual schools or types of schools are possible"", but my understanding is that this should be roughly right.",https://www.bmbwf.gv.at/Themen/schule/schulpraxis/termine/ferientermine_20_21.html,6 January 2021,,https://www.bmbwf.gv.at/Themen/schule/schulpraxis/termine/ferientermine_20_21.htmll,,Christmas holidays,holidays,24 December 2020,"""Deviations for individual schools or types of schools are possible"", but my understanding is that this should be roughly right.",https://www.bmbwf.gv.at/Themen/schule/schulpraxis/termine/ferientermine_20_21.html,6 January 2021,,https://www.bmbwf.gv.at/Themen/schule/schulpraxis/termine/ferientermine_20_21.htmll, ,,,,,,,,,,,,,,,,,,,,
Austria,Nieder­österreich,,1000,no,"Max 1000 guests at outdoor public events for 21/24 districts in the State, except for national or international sporting events for which 1500 are allowed",26 October 2020,"At the 2020/10/22 meeting of the corona ampel committee, 21 of the 24 districts in Niederoesterreich became orange or red. Previously, 16 were orange and none were red. I think 21/24 districts is enough to say that most public indoor gatherings in the State were affected. The rules say that at most 1000 people are allowed at outdoor events, except for national or international sport (for which 1500 people are allowed). We think we can consider most events to be limited by the 1000 number. The rules applied to orange or red districts, coming into effect the Monday following the traffic light colour change.",https://web.archive.org/web/20201027152713/https://corona-ampel.gv.at/aktuelle-massnahmen/regionale-zusaetzliche-massnahmen/niederoesterreich/ https://web.archive.org/web/20201023044344/http://www.noe.gv.at/noe/Corona-Sonderregelungen_in_Niederoesterreich.html https://corona-ampel.gv.at/sites/corona-ampel.gv.at/files/inline-files/Kommission%20_20201015_Sitzungsergebnis_bf.pdf https://corona-ampel.gv.at/sites/corona-ampel.gv.at/files/Kommission_20201022_Sitzungsergebnis_bf.pdf https://www.noe.gv.at/noe/Corona_VO_Sonderregelungen_BHWB_Konsolidierung.pdf https://www.noen.at/niederoesterreich/politik/eigene-regeln-bei-orange-noe-verschaerft-corona-massnahmen-lockdown-verhindern-niederoesterreich-corona-corona-ampel-corona-beschraenkungen-corona-cluster-corona-massnahmen-coronavirus-johanna-mikl-leitner-225677283#,2 November 2020,"See § 13. (1)-(3), especially § 13. (3) 8th. ""(1) Events are prohibited... (3) Paragraph 1 does not apply to... 8th. Meetings of no more than six people, although they may only come from two different households, plus their underage children or minors who are subject to supervision, but no more than six minors in total."". For some reason this isn't advertised on the main information page (https://web.archive.org/web/20201109211208/https://www.sozialministerium.at/Informationen-zum-Coronavirus/Coronavirus---Aktuelle-Ma%C3%9Fnahmen.html)",https://www.ris.bka.gv.at/Dokumente/BgblAuth/BGBLA_2020_II_463/BGBLA_2020_II_463.html, ,250,no,Max 250 guests at indoor public events for 21/24 districts in the State,26 October 2020,"At the 2020/10/22 meeting of the corona ampel committee, 21 of the 24 districts in Niederoesterreich became orange or red. Previously, 16 were orange and none were red. I think 21/24 districts is enough to say that most public indoor gatherings in the State were affected. The rules say that at most 250 people are allowed at indoor events. The rules applied to orange or red districts, coming into effect the Monday following the traffic light colour change.",https://web.archive.org/web/20201027152713/https://corona-ampel.gv.at/aktuelle-massnahmen/regionale-zusaetzliche-massnahmen/niederoesterreich/ https://web.archive.org/web/20201023044344/http://www.noe.gv.at/noe/Corona-Sonderregelungen_in_Niederoesterreich.html https://corona-ampel.gv.at/sites/corona-ampel.gv.at/files/inline-files/Kommission%20_20201015_Sitzungsergebnis_bf.pdf https://corona-ampel.gv.at/sites/corona-ampel.gv.at/files/Kommission_20201022_Sitzungsergebnis_bf.pdf https://www.noe.gv.at/noe/Corona_VO_Sonderregelungen_BHWB_Konsolidierung.pdf https://www.noen.at/niederoesterreich/politik/eigene-regeln-bei-orange-noe-verschaerft-corona-massnahmen-lockdown-verhindern-niederoesterreich-corona-corona-ampel-corona-beschraenkungen-corona-cluster-corona-massnahmen-coronavirus-johanna-mikl-leitner-225677283#,2 November 2020,"See § 13. (1)-(3), especially § 13. (3) 8th. ""(1) Events are prohibited... (3) Paragraph 1 does not apply to... 8th. Meetings of no more than six people, although they may only come from two different households, plus their underage children or minors who are subject to supervision, but no more than six minors in total."". For some reason this isn't advertised on the main information page (https://web.archive.org/web/20201109211208/https://www.sozialministerium.at/Informationen-zum-Coronavirus/Coronavirus---Aktuelle-Ma%C3%9Fnahmen.html)",https://www.ris.bka.gv.at/Dokumente/BgblAuth/BGBLA_2020_II_463/BGBLA_2020_II_463.html, ,6,2,Max 6 adults and 6 children from up to 2 households,3 November 2020,"See § 13. (1)-(3), especially § 13. (3) 8th. ""(1) Events are prohibited... (3) Paragraph 1 does not apply to... 8th. Meetings of no more than six people, although they may only come from two different households, plus their underage children or minors who are subject to supervision, but no more than six minors in total."". For some reason this isn't advertised on the main information page (https://web.archive.org/web/20201109211208/https://www.sozialministerium.at/Informationen-zum-Coronavirus/Coronavirus---Aktuelle-Ma%C3%9Fnahmen.html)",https://www.ris.bka.gv.at/Dokumente/BgblAuth/BGBLA_2020_II_463/BGBLA_2020_II_463.html,16 November 2020,"""§ 12. (1) Leaving your own private living area and staying outside your own private living area for the purpose of participating in events is only permitted for the following events [long ish list follows]""",https://www.ris.bka.gv.at/Dokumente/BgblAuth/BGBLA_2020_II_479/BGBLA_2020_II_479.html https://web.archive.org/web/20201117092500/https://www.sozialministerium.at/Informationen-zum-Coronavirus/Coronavirus---Aktuelle-Ma%C3%9Fnahmen.html, ,,,,,,,,,,,,,,,,,,,,,,,,,,,,,,,,,,,,,,,,,,,,,,,,,,,,,,,,,,,"Primary schools only open for ""care""",COVID,7 January 2021,"""Schools and universities remain in distance learning."" The government rules seem to be more or less the same as for the 17 November - 6 December lockdown. I'm assuming that the behaviour from parents was similar -- in any case, this is a very short time period so it's less important.",https://archive.vn/dXePU,no,,https://archive.vn/dXePU,,"Last 5 grades of secondary school on ""distance learning"", though some in-person attendance is possible; first 4 grades of secondary school only open for ""care""",COVID,7 January 2021,"""Schools and universities remain in distance learning."" The government rules seem to be more or less the same as for the 17 November - 6 December lockdown. I'm assuming that the behaviour from parents was similar -- in any case, this is a very short time period so it's less important.",https://archive.vn/dXePU,no,,https://archive.vn/dXePU, ,,,,,,,,,,,,,,,,,,,,
