Austria,Burgenland,,6,2,"Most events prohibited, except up to 6 adults, 6 children from up to 2 households",7 December 2020,"""Events are prohibited (e.g. birthday parties, wedding celebrations, cultural events, sporting events). This does not apply to meetings of 2 households (max. 6 adults and 6 children), ...""",https://web.archive.org/web/20201207170144/https://www.sozialministerium.at/Informationen-zum-Coronavirus/Coronavirus---Aktuelle-Ma%C3%9Fnahmen.html,23 December 2020,"From ordinance: ""(7) On December 24th and 25th, 2020:... Notwithstanding Section 13, Paragraph 3, Item 10, meetings of no more than ten people are permitted, although these may come from a maximum of ten different households"". From government website: ""At private Christmas parties on 24 . and 25 . December allowed 10 people  to come together""",https://www.ris.bka.gv.at/Dokumente/BgblAuth/BGBLA_2020_II_566/BGBLA_2020_II_566.html https://web.archive.org/web/20201222220659/https://www.sozialministerium.at/Informationen-zum-Coronavirus/Coronavirus---Aktuelle-Ma%C3%9Fnahmen.html, ,6,2,"Most events prohibited, except up to 6 adults, 6 children from up to 2 households",7 December 2020,"""Events are prohibited (e.g. birthday parties, wedding celebrations, cultural events, sporting events). This does not apply to meetings of 2 households (max. 6 adults and 6 children), ...""",https://web.archive.org/web/20201207170144/https://www.sozialministerium.at/Informationen-zum-Coronavirus/Coronavirus---Aktuelle-Ma%C3%9Fnahmen.html,23 December 2020,"From ordinance: ""(7) On December 24th and 25th, 2020:... Notwithstanding Section 13, Paragraph 3, Item 10, meetings of no more than ten people are permitted, although these may come from a maximum of ten different households"". From government website: ""At private Christmas parties on 24 . and 25 . December allowed 10 people  to come together""",https://www.ris.bka.gv.at/Dokumente/BgblAuth/BGBLA_2020_II_566/BGBLA_2020_II_566.html https://web.archive.org/web/20201222220659/https://www.sozialministerium.at/Informationen-zum-Coronavirus/Coronavirus---Aktuelle-Ma%C3%9Fnahmen.html, ,6,2,Max 6 adults and 6 children from up to 2 households (outside of curfew),7 December 2020,Two households (up to 6 adults and 6 children) can meet between 6 a.m. and 8 p.m,https://web.archive.org/web/20201207170144/https://www.sozialministerium.at/Informationen-zum-Coronavirus/Coronavirus---Aktuelle-Ma%C3%9Fnahmen.html https://www.ris.bka.gv.at/Dokumente/BgblAuth/BGBLA_2020_II_544/BGBLA_2020_II_544.html,23 December 2020,"From ordinance: ""(7) On December 24th and 25th, 2020:... Notwithstanding Section 13, Paragraph 3, Item 10, meetings of no more than ten people are permitted, although these may come from a maximum of ten different households"". From government website: ""At private Christmas parties on 24 . and 25 . December allowed 10 people  to come together""",https://www.ris.bka.gv.at/Dokumente/BgblAuth/BGBLA_2020_II_566/BGBLA_2020_II_566.html https://web.archive.org/web/20201222220659/https://www.sozialministerium.at/Informationen-zum-Coronavirus/Coronavirus---Aktuelle-Ma%C3%9Fnahmen.html, ,,,,,,,,,,,,,,,,,,,,,,,,,,,,,,,,,,,,,,,,,,,,,,,,,,,,,,,,,,,,,,,,,,,,,,,,,,,,,,,,,,,,,,,,,,,,,,,,
Austria,Burgenland,,10,10,Christmas parties with max 10 people from up to 10 households permitted,24 December 2020,"From ordinance: ""(7) On December 24th and 25th, 2020:... Notwithstanding Section 13, Paragraph 3, Item 10, meetings of no more than ten people are permitted, although these may come from a maximum of ten different households"". From government website: ""At private Christmas parties on 24 . and 25 . December allowed 10 people  to come together""",https://www.ris.bka.gv.at/Dokumente/BgblAuth/BGBLA_2020_II_566/BGBLA_2020_II_566.html https://web.archive.org/web/20201222220659/https://www.sozialministerium.at/Informationen-zum-Coronavirus/Coronavirus---Aktuelle-Ma%C3%9Fnahmen.html,25 December 2020,"""§ 12. (1) Leaving your own private living area and staying outside your own private living area for the purpose of participating in events is only permitted for the following events [long ish list follows]""",https://web.archive.org/web/20201229144455/https://www.sozialministerium.at/Informationen-zum-Coronavirus/Coronavirus---Aktuelle-Ma%C3%9Fnahmen.html https://www.ris.bka.gv.at/Dokumente/BgblAuth/BGBLA_2020_II_598/BGBLA_2020_II_598.html, ,10,10,Christmas parties with max 10 people from up to 10 households permitted,24 December 2020,"From ordinance: ""(7) On December 24th and 25th, 2020:... Notwithstanding Section 13, Paragraph 3, Item 10, meetings of no more than ten people are permitted, although these may come from a maximum of ten different households"". From government website: ""At private Christmas parties on 24 . and 25 . December allowed 10 people  to come together""",https://www.ris.bka.gv.at/Dokumente/BgblAuth/BGBLA_2020_II_566/BGBLA_2020_II_566.html https://web.archive.org/web/20201222220659/https://www.sozialministerium.at/Informationen-zum-Coronavirus/Coronavirus---Aktuelle-Ma%C3%9Fnahmen.html,25 December 2020,"""§ 12. (1) Leaving your own private living area and staying outside your own private living area for the purpose of participating in events is only permitted for the following events [long ish list follows]""",https://web.archive.org/web/20201229144455/https://www.sozialministerium.at/Informationen-zum-Coronavirus/Coronavirus---Aktuelle-Ma%C3%9Fnahmen.html https://www.ris.bka.gv.at/Dokumente/BgblAuth/BGBLA_2020_II_598/BGBLA_2020_II_598.html, ,10,10,Christmas parties with max 10 people from up to 10 households permitted,24 December 2020,"From ordinance: ""(7) On December 24th and 25th, 2020:... Notwithstanding Section 13, Paragraph 3, Item 10, meetings of no more than ten people are permitted, although these may come from a maximum of ten different households"". From government website: ""At private Christmas parties on 24 . and 25 . December allowed 10 people  to come together""",https://www.ris.bka.gv.at/Dokumente/BgblAuth/BGBLA_2020_II_566/BGBLA_2020_II_566.html https://web.archive.org/web/20201222220659/https://www.sozialministerium.at/Informationen-zum-Coronavirus/Coronavirus---Aktuelle-Ma%C3%9Fnahmen.html,25 December 2020,"""§ 12. (1) Leaving your own private living area and staying outside your own private living area for the purpose of participating in events is only permitted for the following events [long ish list follows]""",https://web.archive.org/web/20201229144455/https://www.sozialministerium.at/Informationen-zum-Coronavirus/Coronavirus---Aktuelle-Ma%C3%9Fnahmen.html https://www.ris.bka.gv.at/Dokumente/BgblAuth/BGBLA_2020_II_598/BGBLA_2020_II_598.html, ,,,,,,,,,,,,,,,,,,,,,,,,,,,,,,,,,,,,,,,,,,,,,,,,,,,,,,,,,,,,,,,,,,,,,,,,,,,,,,,,,,,,,,,,,,,,,,,,
Austria,Burgenland,,1,1,Meeting people is generally prohibited,26 December 2020,"""§ 12. (1) Leaving your own private living area and staying outside your own private living area for the purpose of participating in events is only permitted for the following events: [long ish list follows]""",https://web.archive.org/web/20201229144455/https://www.sozialministerium.at/Informationen-zum-Coronavirus/Coronavirus---Aktuelle-Ma%C3%9Fnahmen.html https://www.ris.bka.gv.at/Dokumente/BgblAuth/BGBLA_2020_II_598/BGBLA_2020_II_598.html,no,"Advice on government website appears unchanged since 2020/12/26, as of today (2021/01/12). Also ordinance that came into force on 2020/12/26 was amended such that it was extended to run until 2021/01/14.",Archived government advice page: https://archive.vn/dXePU. old ordinance: https://www.ris.bka.gv.at/Dokumente/BgblAuth/BGBLA_2020_II_598/BGBLA_2020_II_598.html. amendment to extend old ordinance: https://www.ris.bka.gv.at/Dokumente/BgblAuth/BGBLA_2021_II_2/BGBLA_2021_II_2.html, ,1,1,Meeting people is generally prohibited,26 December 2020,"""§ 12. (1) Leaving your own private living area and staying outside your own private living area for the purpose of participating in events is only permitted for the following events: [long ish list follows]""",https://web.archive.org/web/20201229144455/https://www.sozialministerium.at/Informationen-zum-Coronavirus/Coronavirus---Aktuelle-Ma%C3%9Fnahmen.html https://www.ris.bka.gv.at/Dokumente/BgblAuth/BGBLA_2020_II_598/BGBLA_2020_II_598.html,no,"Advice on government website appears unchanged since 2020/12/26, as of today (2021/01/12). Also ordinance that came into force on 2020/12/26 was amended such that it was extended to run until 2021/01/14.",Archived government advice page: https://archive.vn/dXePU. old ordinance: https://www.ris.bka.gv.at/Dokumente/BgblAuth/BGBLA_2020_II_598/BGBLA_2020_II_598.html. amendment to extend old ordinance: https://www.ris.bka.gv.at/Dokumente/BgblAuth/BGBLA_2021_II_2/BGBLA_2021_II_2.html, ,1,1,Meeting people is generally prohibited,26 December 2020,"""§ 12. (1) Leaving your own private living area and staying outside your own private living area for the purpose of participating in events is only permitted for the following events: [long ish list follows]""",https://web.archive.org/web/20201229144455/https://www.sozialministerium.at/Informationen-zum-Coronavirus/Coronavirus---Aktuelle-Ma%C3%9Fnahmen.html https://www.ris.bka.gv.at/Dokumente/BgblAuth/BGBLA_2020_II_598/BGBLA_2020_II_598.html,no,"Advice on government website appears unchanged since 2020/12/26, as of today (2021/01/12). Also ordinance that came into force on 2020/12/26 was amended such that it was extended to run until 2021/01/14.",Archived government advice page: https://archive.vn/dXePU. old ordinance: https://www.ris.bka.gv.at/Dokumente/BgblAuth/BGBLA_2020_II_598/BGBLA_2020_II_598.html. amendment to extend old ordinance: https://www.ris.bka.gv.at/Dokumente/BgblAuth/BGBLA_2021_II_2/BGBLA_2021_II_2.html, ,,,,,,,,,,,,,,,,,,,,,,,,,,,,,,,,,,,,,,,,,,,,,,,,,,,,,,,,,,,,,,,,,,,,,,,,,,,, ,,,,,,,,,,,,,,,,,,,,
,,,,,,,,,,,,,,,,,,,,,,,,,,,,,,,,,,,,,,,,,,,,,,,,,,,,,,,,,,,,,,,,,,,,,,,,,,,,,,,,,,,,,,,,,,,,,,,,,,,,,,,,,,,,,,,,,,,,,,,,,,,,,,,,
Austria,Steiermark,,1250,no,Max 1250 guests for outdoor events with fixed seats provided this is approved by the locally responsible district administrative authority.,1 August 2020,"""As of August 1, 2020, these numbers will be increased to 500 visitors in closed rooms and 750 visitors in the open air."" ""Furthermore, from August 1, 2020, there will be the possibility of holding events with assigned and marked seats... for up to 1250 people in the open air, provided this is approved by the locally responsible district administrative authority""",https://web.archive.org/web/20200802004525/https://www.sozialministerium.at/Informationen-zum-Coronavirus/Coronavirus---Aktuelle-Ma%C3%9Fnahmen.html,31 August 2020,"""As of September 1, 2020, these numbers will be increased to 5,000 visitors in closed rooms and 10,000 visitors in the open air"" (note that the page was accessed after 2020/09/01",https://web.archive.org/web/20200901122518/https://www.sozialministerium.at/Informationen-zum-Coronavirus/Coronavirus---Aktuelle-Ma%C3%9Fnahmen.html https://web.archive.org/web/20200910224450/https://www.sozialministerium.at/Informationen-zum-Coronavirus/Coronavirus---Aktuelle-Ma%C3%9Fnahmen.html, ,1000,no,Max 1000 guests for indoor events with fixed seats provided this is approved by the locally responsible district administrative authority.,1 August 2020,"""As of August 1, 2020, these numbers will be increased to 500 visitors in closed rooms"" ""Furthermore, from August 1, 2020, there will be the possibility of holding events with assigned and marked seats for up to 1000 people in closed rooms... provided this is approved by the locally responsible district administrative authority""",https://web.archive.org/web/20200802004525/https://www.sozialministerium.at/Informationen-zum-Coronavirus/Coronavirus---Aktuelle-Ma%C3%9Fnahmen.html,31 August 2020,"""As of September 1, 2020, these numbers will be increased to 5,000 visitors in closed rooms and 10,000 visitors in the open air"" (note that the page was accessed after 2020/09/01",https://web.archive.org/web/20200901122518/https://www.sozialministerium.at/Informationen-zum-Coronavirus/Coronavirus---Aktuelle-Ma%C3%9Fnahmen.html https://web.archive.org/web/20200910224450/https://www.sozialministerium.at/Informationen-zum-Coronavirus/Coronavirus---Aktuelle-Ma%C3%9Fnahmen.html, ,1250,no,Max 1250 guests for outdoor events with fixed seats provided this is approved by the locally responsible district administrative authority.,1 August 2020,I can't see anything specific regarding private as opposed to public gatherings in the advice given,https://web.archive.org/web/20200802004525/https://www.sozialministerium.at/Informationen-zum-Coronavirus/Coronavirus---Aktuelle-Ma%C3%9Fnahmen.html,31 August 2020,"""As of September 1, 2020, these numbers will be increased to 5,000 visitors in closed rooms and 10,000 visitors in the open air"" (note that the page was accessed after 2020/09/01",https://web.archive.org/web/20200901122518/https://www.sozialministerium.at/Informationen-zum-Coronavirus/Coronavirus---Aktuelle-Ma%C3%9Fnahmen.html https://web.archive.org/web/20200910224450/https://www.sozialministerium.at/Informationen-zum-Coronavirus/Coronavirus---Aktuelle-Ma%C3%9Fnahmen.html, ,1,1,"Although private gatherings in homes could not be regulated, during hard lockdowns private gatherings in other indoor venues would be banned. In addition functionally due to curfew and hard lockdowns most gatherings in private indoor venues were unlikley to take place during the hard lockdown. As agreed by multiple researchers after discussion with local epidemiologists ",17 November 2020,"See edge case doc: https://docs.google.com/document/d/1fdQIMDP-yeLAnMt3_09GwxyUL5TgsymLnRBxASVR84w/edit and mention of this legal difficulty here, for example: https://www.covid19healthsystem.org/countries/austria/livinghit.aspx?Section=1.2%20Physical%20distancing&Type=Section#3Physicaldistancing",https://web.archive.org/web/20201116184636/https://www.sozialministerium.at/Informationen-zum-Coronavirus/Coronavirus---Aktuelle-Ma%C3%9Fnahmen.html,6 December 2020,"Although private gatherings in homes could not be regulated, during hard lockdowns private gatherings in other indoor venues would be banned. In addition functionally due to curfew and hard lockdowns most gatherings in private indoor venues were unlikley to take place during the hard lockdown. As agreed by multiple researchers after discussion with local epidemiologists ",https://web.archive.org/web/20201207170144/https://www.sozialministerium.at/Informationen-zum-Coronavirus/Coronavirus---Aktuelle-Ma%C3%9Fnahmen.html,,"Night clubs closed, Gastronomy take-away only; most leisure activities closed",3 November 2020,"""Catering establishments are only allowed to offer food for collection from 6 a.m. to 8 p.m., direct consumption in catering establishments is no longer permitted""",https://web.archive.org/web/20201109211208/https://www.sozialministerium.at/Informationen-zum-Coronavirus/Coronavirus---Aktuelle-Ma%C3%9Fnahmen.html,no,"""Catering establishments may offer pick-up from 6 a.m. to 7 p.m. Delivery service is possible 24/7. Consumption on site is not permitted (exception: company canteens).""",Archived government advice page: https://archive.vn/dXePU. old ordinance: https://www.ris.bka.gv.at/Dokumente/BgblAuth/BGBLA_2020_II_598/BGBLA_2020_II_598.html. amendment to extend old ordinance: https://www.ris.bka.gv.at/Dokumente/BgblAuth/BGBLA_2021_II_2/BGBLA_2021_II_2.html,,Take-away only,3 November 2020,"""Catering establishments are only allowed to offer food for collection from 6 a.m. to 8 p.m., direct consumption in catering establishments is no longer permitted""",https://web.archive.org/web/20201109211208/https://www.sozialministerium.at/Informationen-zum-Coronavirus/Coronavirus---Aktuelle-Ma%C3%9Fnahmen.html,no,"""Catering establishments may offer pick-up from 6 a.m. to 7 p.m. Delivery service is possible 24/7. Consumption on site is not permitted (exception: company canteens).""",Archived government advice page: https://archive.vn/dXePU. old ordinance: https://www.ris.bka.gv.at/Dokumente/BgblAuth/BGBLA_2020_II_598/BGBLA_2020_II_598.html. amendment to extend old ordinance: https://www.ris.bka.gv.at/Dokumente/BgblAuth/BGBLA_2021_II_2/BGBLA_2021_II_2.html,,Most leisure activities closed,3 November 2020,"""Leisure and cultural activities remain closed, with the exception of libraries"", ""Indoor sports facilities remain closed during the period of the regulation, with the exception of use by top athletes""",https://web.archive.org/web/20201109211208/https://www.sozialministerium.at/Informationen-zum-Coronavirus/Coronavirus---Aktuelle-Ma%C3%9Fnahmen.html,no,"I think we can say ""a large fraction"" of leisure and cultural venues are closed in this period. The easiest way to verify this is probably to go through the ordinances provided in the sources cell, which cover the period 2020/11/03 to 2021/01/09. See § 12 in each doc (where applicable)",https://www.ris.bka.gv.at/Dokumente/BgblAuth/BGBLA_2020_II_463/BGBLA_2020_II_463.html https://www.ris.bka.gv.at/Dokumente/BgblAuth/BGBLA_2020_II_479/BGBLA_2020_II_479.html https://www.ris.bka.gv.at/Dokumente/BgblAuth/BGBLA_2020_II_544/BGBLA_2020_II_544.html https://www.ris.bka.gv.at/Dokumente/BgblAuth/BGBLA_2020_II_566/BGBLA_2020_II_566.html https://www.ris.bka.gv.at/Dokumente/BgblAuth/BGBLA_2021_II_2/BGBLA_2021_II_2.html,,More or less everything closed except ~essential shops etc,17 November 2020,"(from the regulation) ""§ 5. (1) Entering and driving the customer area of 1. Business premises for the purpose of purchasing goods, 2. Service companies for the use of body-hugging services... is prohibited"" i.e. retail and close-contact services are closed",https://web.archive.org/web/20201117092500/https://www.sozialministerium.at/Informationen-zum-Coronavirus/Coronavirus---Aktuelle-Ma%C3%9Fnahmen.html https://www.ris.bka.gv.at/Dokumente/BgblAuth/BGBLA_2020_II_479/BGBLA_2020_II_479.html,6 December 2020,"""retail trade The trade will open again from December 7th, the shops may stay open until 7 p.m. at the latest... All services, including those close to the body (hairdressers, masseurs, etc.), may be offered""",https://web.archive.org/web/20201207170144/https://www.sozialministerium.at/Informationen-zum-Coronavirus/Coronavirus---Aktuelle-Ma%C3%9Fnahmen.html,,More or less everything closed except ~essential shops etc,17 November 2020,,https://web.archive.org/web/20201117092500/https://www.sozialministerium.at/Informationen-zum-Coronavirus/Coronavirus---Aktuelle-Ma%C3%9Fnahmen.html https://www.ris.bka.gv.at/Dokumente/BgblAuth/BGBLA_2020_II_479/BGBLA_2020_II_479.html,6 December 2020,"""retail trade The trade will open again from December 7th, the shops may stay open until 7 p.m. at the latest.""",https://web.archive.org/web/20201207170144/https://www.sozialministerium.at/Informationen-zum-Coronavirus/Coronavirus---Aktuelle-Ma%C3%9Fnahmen.html,,Leaving home between 8pm and 6am is only permitted under limited conditions,3 November 2020,"""Leaving your own private living area and staying outside your own private living area between 8 p.m. and 6 a.m. is only permitted under the following conditions...""",https://web.archive.org/web/20201109211208/https://www.sozialministerium.at/Informationen-zum-Coronavirus/Coronavirus---Aktuelle-Ma%C3%9Fnahmen.html,16 November 2020,Curfew became a 24 hour stay at home order.,https://www.ris.bka.gv.at/Dokumente/BgblAuth/BGBLA_2020_II_479/BGBLA_2020_II_479.html,,summer vacation,holidays,before 1 August 2020,"My understanding of the source is that the stated dates are prescribed for some types of school, and usually applied to other types; and so we can consider them to roughly apply to all schools for our purposes. See also https://de.wikipedia.org/wiki/Bildungssystem_in_%C3%96sterreich#%C3%9Cbersicht:_Bildungsebenen_und_Schultypen",https://www.bmbwf.gv.at/Themen/schule/schulpraxis/termine/ferientermine_19_20.html,13 September 2020,"""Summer vacation 2) Main vacation July 4, 2020 - September 6, 2020 Burgenland, Lower Austria, Vienna        July 11, 2020 - September 13, 2020 Carinthia, Upper Austria, Salzburg, Styria, Tyrol, Vorarlberg""",https://www.bmbwf.gv.at/Themen/schule/schulpraxis/termine/ferientermine_19_20.html,,summer vacation,holidays,before 1 August 2020,"My understanding of the source is that the stated dates are prescribed for some types of school, and usually applied to other types; and so we can consider them to roughly apply to all schools for our purposes. See also https://de.wikipedia.org/wiki/Bildungssystem_in_%C3%96sterreich#%C3%9Cbersicht:_Bildungsebenen_und_Schultypen",https://www.bmbwf.gv.at/Themen/schule/schulpraxis/termine/ferientermine_19_20.html,13 September 2020,"""Summer vacation 2) Main vacation July 4, 2020 - September 6, 2020 Burgenland, Lower Austria, Vienna        July 11, 2020 - September 13, 2020 Carinthia, Upper Austria, Salzburg, Styria, Tyrol, Vorarlberg""",https://www.bmbwf.gv.at/Themen/schule/schulpraxis/termine/ferientermine_19_20.html, ,summer vacation,before 1 August 2020,,https://www.uni-graz.at/en/studying/info-and-service/important-dates-and-deadlines/ https://www.tugraz.at/studium/studieren-an-der-tu-graz/studienanfaengerinnen-und-studienanfaenger/einteilung-des-studienjahres/ https://www.medunigraz.at/lehren/information-und-service/studienjahreinteilung/ https://www.fh-joanneum.at/en/university/services/academic-calendar/academic-year-2020-2021/ https://www.unileoben.ac.at/studium/termine-und-fristen,30 September 2020,"I looked at the 5 ~biggest universities, which together account for >80% of the student population in the State. 4 of them start on 1 October. One, FH-Joanneum, starts full-time programmes on 28 September. It accounts for ~5k of the ~65k student population. So it seems reasonable to say that most students were on vacation until 1 October 2020",https://www.uni-graz.at/en/studying/info-and-service/important-dates-and-deadlines/ https://www.tugraz.at/studium/studieren-an-der-tu-graz/studienanfaengerinnen-und-studienanfaenger/einteilung-des-studienjahres/ https://www.medunigraz.at/lehren/information-und-service/studienjahreinteilung/ https://www.fh-joanneum.at/en/university/services/academic-calendar/academic-year-2020-2021/ https://www.unileoben.ac.at/studium/termine-und-fristen,,>1,63000,1.20E+06,,2,"Mouth and nose protection to be worn in specified places (shops, public transport, ...)",before 1 August 2020,,https://web.archive.org/web/20200802004525/https://www.sozialministerium.at/Informationen-zum-Coronavirus/Coronavirus---Aktuelle-Ma%C3%9Fnahmen.html,13 September 2020,"""Since September 14th an MNS has to be worn in the following areas: [a long list follows]"". Note that I'm deferring to OXCGRT here since we're using their definitions. It's not especially clear to me that the measures correspond to ""3"" rather than ""2"", but OXCGRT has them as ""3"".",https://web.archive.org/web/20200914085401/https://www.sozialministerium.at/Informationen-zum-Coronavirus/Coronavirus---Aktuelle-Ma%C3%9Fnahmen.html
