Austria,Tirol,,1500,no,Max 1500 guests for outdoor public events with fixed seats and masks,23 October 2020,"""Public events (such as theater performances and concerts) may take place with a maximum of 1,000 people inside and 1,500 outside""",https://web.archive.org/web/20201023152100/https://orf.at/stories/3185779/,2 November 2020,"See § 13. (1)-(3), especially § 13. (3) 8th. ""(1) Events are prohibited... (3) Paragraph 1 does not apply to... 8th. Meetings of no more than six people, although they may only come from two different households, plus their underage children or minors who are subject to supervision, but no more than six minors in total."". For some reason this isn't advertised on the main information page (https://web.archive.org/web/20201109211208/https://www.sozialministerium.at/Informationen-zum-Coronavirus/Coronavirus---Aktuelle-Ma%C3%9Fnahmen.html)",https://www.ris.bka.gv.at/Dokumente/BgblAuth/BGBLA_2020_II_463/BGBLA_2020_II_463.html, ,1000,no,Max 1000 guests for indoor public events with fixed seats and masks,23 October 2020,"""Public events (such as theater performances and concerts) may take place with a maximum of 1,000 people inside and 1,500 outside""",https://web.archive.org/web/20201023152100/https://orf.at/stories/3185779/,2 November 2020,"See § 13. (1)-(3), especially § 13. (3) 8th. ""(1) Events are prohibited... (3) Paragraph 1 does not apply to... 8th. Meetings of no more than six people, although they may only come from two different households, plus their underage children or minors who are subject to supervision, but no more than six minors in total."". For some reason this isn't advertised on the main information page (https://web.archive.org/web/20201109211208/https://www.sozialministerium.at/Informationen-zum-Coronavirus/Coronavirus---Aktuelle-Ma%C3%9Fnahmen.html)",https://www.ris.bka.gv.at/Dokumente/BgblAuth/BGBLA_2020_II_463/BGBLA_2020_II_463.html, ,12,no,Max 12 people at outdoor gatherings,23 October 2020,"""the federal government presented new corona measures. These will go into effect on Friday... Outdoor meetings are limited to 12 people""",https://web.archive.org/web/20201024060408/https://metropole.at/coronavirus-in-austria/,2 November 2020,"See § 13. (1)-(3), especially § 13. (3) 8th. ""(1) Events are prohibited... (3) Paragraph 1 does not apply to... 8th. Meetings of no more than six people, although they may only come from two different households, plus their underage children or minors who are subject to supervision, but no more than six minors in total."". For some reason this isn't advertised on the main information page (https://web.archive.org/web/20201109211208/https://www.sozialministerium.at/Informationen-zum-Coronavirus/Coronavirus---Aktuelle-Ma%C3%9Fnahmen.html)",https://www.ris.bka.gv.at/Dokumente/BgblAuth/BGBLA_2020_II_463/BGBLA_2020_II_463.html, ,,,,,,,,,,,,,,,,,,,,,,,,,,,,,,,,,,,,,,,,,,,,,,,,,,,,,,,,,,,Christmas holidays,holidays,24 December 2020,"""Deviations for individual schools or types of schools are possible"", but my understanding is that this should be roughly right.",https://www.bmbwf.gv.at/Themen/schule/schulpraxis/termine/ferientermine_20_21.html,6 January 2021,,https://www.bmbwf.gv.at/Themen/schule/schulpraxis/termine/ferientermine_20_21.htmll,,Christmas holidays,holidays,24 December 2020,"""Deviations for individual schools or types of schools are possible"", but my understanding is that this should be roughly right.",https://www.bmbwf.gv.at/Themen/schule/schulpraxis/termine/ferientermine_20_21.html,6 January 2021,,https://www.bmbwf.gv.at/Themen/schule/schulpraxis/termine/ferientermine_20_21.htmll, ,,,,,,,,,,,,,,,,,,,,
Austria,Tirol,,6,2,"Most events cancelled. Exceptions include elite sporting events and artistic performances (with no audience), etc; and meetings of up to 6 adults and 6 children from up to 2 households",3 November 2020,"See § 13. (1)-(3), especially § 13. (3) 8th. ""(1) Events are prohibited... (3) Paragraph 1 does not apply to... 8th. Meetings of no more than six people, although they may only come from two different households, plus their underage children or minors who are subject to supervision, but no more than six minors in total."". For some reason this isn't advertised on the main information page (https://web.archive.org/web/20201109211208/https://www.sozialministerium.at/Informationen-zum-Coronavirus/Coronavirus---Aktuelle-Ma%C3%9Fnahmen.html)",https://www.ris.bka.gv.at/Dokumente/BgblAuth/BGBLA_2020_II_463/BGBLA_2020_II_463.html,16 November 2020,"""§ 12. (1) Leaving your own private living area and staying outside your own private living area for the purpose of participating in events is only permitted for the following events [long ish list follows]""",https://www.ris.bka.gv.at/Dokumente/BgblAuth/BGBLA_2020_II_479/BGBLA_2020_II_479.html https://web.archive.org/web/20201117092500/https://www.sozialministerium.at/Informationen-zum-Coronavirus/Coronavirus---Aktuelle-Ma%C3%9Fnahmen.html, ,6,2,"Most events cancelled. Exceptions include elite sporting events and artistic performances (with no audience), etc; and meetings of up to 6 adults and 6 children from up to 2 households",3 November 2020,"See § 13. (1)-(3), especially § 13. (3) 8th. ""(1) Events are prohibited... (3) Paragraph 1 does not apply to... 8th. Meetings of no more than six people, although they may only come from two different households, plus their underage children or minors who are subject to supervision, but no more than six minors in total."". For some reason this isn't advertised on the main information page (https://web.archive.org/web/20201109211208/https://www.sozialministerium.at/Informationen-zum-Coronavirus/Coronavirus---Aktuelle-Ma%C3%9Fnahmen.html)",https://www.ris.bka.gv.at/Dokumente/BgblAuth/BGBLA_2020_II_463/BGBLA_2020_II_463.html,16 November 2020,"""§ 12. (1) Leaving your own private living area and staying outside your own private living area for the purpose of participating in events is only permitted for the following events [long ish list follows]""",https://www.ris.bka.gv.at/Dokumente/BgblAuth/BGBLA_2020_II_479/BGBLA_2020_II_479.html https://web.archive.org/web/20201117092500/https://www.sozialministerium.at/Informationen-zum-Coronavirus/Coronavirus---Aktuelle-Ma%C3%9Fnahmen.html, ,6,2,Max 6 adults and 6 children from up to 2 households,3 November 2020,"See § 13. (1)-(3), especially § 13. (3) 8th. ""(1) Events are prohibited... (3) Paragraph 1 does not apply to... 8th. Meetings of no more than six people, although they may only come from two different households, plus their underage children or minors who are subject to supervision, but no more than six minors in total."". For some reason this isn't advertised on the main information page (https://web.archive.org/web/20201109211208/https://www.sozialministerium.at/Informationen-zum-Coronavirus/Coronavirus---Aktuelle-Ma%C3%9Fnahmen.html)",https://www.ris.bka.gv.at/Dokumente/BgblAuth/BGBLA_2020_II_463/BGBLA_2020_II_463.html,16 November 2020,"""§ 12. (1) Leaving your own private living area and staying outside your own private living area for the purpose of participating in events is only permitted for the following events [long ish list follows]""",https://www.ris.bka.gv.at/Dokumente/BgblAuth/BGBLA_2020_II_479/BGBLA_2020_II_479.html https://web.archive.org/web/20201117092500/https://www.sozialministerium.at/Informationen-zum-Coronavirus/Coronavirus---Aktuelle-Ma%C3%9Fnahmen.html, ,,,,,,,,,,,,,,,,,,,,,,,,,,,,,,,,,,,,,,,,,,,,,,,,,,,,,,,,,,,"Primary schools only open for ""care""",COVID,7 January 2021,"""Schools and universities remain in distance learning."" The government rules seem to be more or less the same as for the 17 November - 6 December lockdown. I'm assuming that the behaviour from parents was similar -- in any case, this is a very short time period so it's less important.",https://archive.vn/dXePU,no,,https://archive.vn/dXePU,,"Last 5 grades of secondary school on ""distance learning"", though some in-person attendance is possible; first 4 grades of secondary school only open for ""care""",COVID,7 January 2021,"""Schools and universities remain in distance learning."" The government rules seem to be more or less the same as for the 17 November - 6 December lockdown. I'm assuming that the behaviour from parents was similar -- in any case, this is a very short time period so it's less important.",https://archive.vn/dXePU,no,,https://archive.vn/dXePU, ,,,,,,,,,,,,,,,,,,,,
Austria,Tirol,,1,1,Meeting people is generally prohibited,17 November 2020,"""§ 12. (1) Leaving your own private living area and staying outside your own private living area for the purpose of participating in events is only permitted for the following events [long ish list follows]""",https://www.ris.bka.gv.at/Dokumente/BgblAuth/BGBLA_2020_II_479/BGBLA_2020_II_479.html https://web.archive.org/web/20201117092500/https://www.sozialministerium.at/Informationen-zum-Coronavirus/Coronavirus---Aktuelle-Ma%C3%9Fnahmen.html,6 December 2020,"""Events are prohibited (e.g. birthday parties, wedding celebrations, cultural events, sporting events). This does not apply to meetings of 2 households (max. 6 adults and 6 children), ...""",https://web.archive.org/web/20201207170144/https://www.sozialministerium.at/Informationen-zum-Coronavirus/Coronavirus---Aktuelle-Ma%C3%9Fnahmen.html, ,1,1,Meeting people is generally prohibited,17 November 2020,"""§ 12. (1) Leaving your own private living area and staying outside your own private living area for the purpose of participating in events is only permitted for the following events [long ish list follows]""",https://www.ris.bka.gv.at/Dokumente/BgblAuth/BGBLA_2020_II_479/BGBLA_2020_II_479.html https://web.archive.org/web/20201117092500/https://www.sozialministerium.at/Informationen-zum-Coronavirus/Coronavirus---Aktuelle-Ma%C3%9Fnahmen.html,6 December 2020,"""Events are prohibited (e.g. birthday parties, wedding celebrations, cultural events, sporting events). This does not apply to meetings of 2 households (max. 6 adults and 6 children), ...""",https://web.archive.org/web/20201207170144/https://www.sozialministerium.at/Informationen-zum-Coronavirus/Coronavirus---Aktuelle-Ma%C3%9Fnahmen.html, ,1,1,Meeting people is generally prohibited,17 November 2020,"""§ 12. (1) Leaving your own private living area and staying outside your own private living area for the purpose of participating in events is only permitted for the following events [long ish list follows]""",https://www.ris.bka.gv.at/Dokumente/BgblAuth/BGBLA_2020_II_479/BGBLA_2020_II_479.html https://web.archive.org/web/20201117092500/https://www.sozialministerium.at/Informationen-zum-Coronavirus/Coronavirus---Aktuelle-Ma%C3%9Fnahmen.html,6 December 2020,Two households (up to 6 adults and 6 children) can meet between 6 a.m. and 8 p.m,https://web.archive.org/web/20201207170144/https://www.sozialministerium.at/Informationen-zum-Coronavirus/Coronavirus---Aktuelle-Ma%C3%9Fnahmen.html https://www.ris.bka.gv.at/Dokumente/BgblAuth/BGBLA_2020_II_544/BGBLA_2020_II_544.html, ,,,,,,,,,,,,,,,,,,,,,,,,,,,,,,,,,,,,,,,,,,,,,,,,,,,,,,,,,,,,,,,,,,,,,,,,,,,, ,,,,,,,,,,,,,,,,,,,,
Austria,Tirol,,6,2,"Most events prohibited, except up to 6 adults, 6 children from up to 2 households",7 December 2020,"""Events are prohibited (e.g. birthday parties, wedding celebrations, cultural events, sporting events). This does not apply to meetings of 2 households (max. 6 adults and 6 children), ...""",https://web.archive.org/web/20201207170144/https://www.sozialministerium.at/Informationen-zum-Coronavirus/Coronavirus---Aktuelle-Ma%C3%9Fnahmen.html,23 December 2020,"From ordinance: ""(7) On December 24th and 25th, 2020:... Notwithstanding Section 13, Paragraph 3, Item 10, meetings of no more than ten people are permitted, although these may come from a maximum of ten different households"". From government website: ""At private Christmas parties on 24 . and 25 . December allowed 10 people  to come together""",https://www.ris.bka.gv.at/Dokumente/BgblAuth/BGBLA_2020_II_566/BGBLA_2020_II_566.html https://web.archive.org/web/20201222220659/https://www.sozialministerium.at/Informationen-zum-Coronavirus/Coronavirus---Aktuelle-Ma%C3%9Fnahmen.html, ,6,2,"Most events prohibited, except up to 6 adults, 6 children from up to 2 households",7 December 2020,"""Events are prohibited (e.g. birthday parties, wedding celebrations, cultural events, sporting events). This does not apply to meetings of 2 households (max. 6 adults and 6 children), ...""",https://web.archive.org/web/20201207170144/https://www.sozialministerium.at/Informationen-zum-Coronavirus/Coronavirus---Aktuelle-Ma%C3%9Fnahmen.html,23 December 2020,"From ordinance: ""(7) On December 24th and 25th, 2020:... Notwithstanding Section 13, Paragraph 3, Item 10, meetings of no more than ten people are permitted, although these may come from a maximum of ten different households"". From government website: ""At private Christmas parties on 24 . and 25 . December allowed 10 people  to come together""",https://www.ris.bka.gv.at/Dokumente/BgblAuth/BGBLA_2020_II_566/BGBLA_2020_II_566.html https://web.archive.org/web/20201222220659/https://www.sozialministerium.at/Informationen-zum-Coronavirus/Coronavirus---Aktuelle-Ma%C3%9Fnahmen.html, ,6,2,Max 6 adults and 6 children from up to 2 households (outside of curfew),7 December 2020,Two households (up to 6 adults and 6 children) can meet between 6 a.m. and 8 p.m,https://web.archive.org/web/20201207170144/https://www.sozialministerium.at/Informationen-zum-Coronavirus/Coronavirus---Aktuelle-Ma%C3%9Fnahmen.html https://www.ris.bka.gv.at/Dokumente/BgblAuth/BGBLA_2020_II_544/BGBLA_2020_II_544.html,23 December 2020,"From ordinance: ""(7) On December 24th and 25th, 2020:... Notwithstanding Section 13, Paragraph 3, Item 10, meetings of no more than ten people are permitted, although these may come from a maximum of ten different households"". From government website: ""At private Christmas parties on 24 . and 25 . December allowed 10 people  to come together""",https://www.ris.bka.gv.at/Dokumente/BgblAuth/BGBLA_2020_II_566/BGBLA_2020_II_566.html https://web.archive.org/web/20201222220659/https://www.sozialministerium.at/Informationen-zum-Coronavirus/Coronavirus---Aktuelle-Ma%C3%9Fnahmen.html, ,,,,,,,,,,,,,,,,,,,,,,,,,,,,,,,,,,,,,,,,,,,,,,,,,,,,,,,,,,,,,,,,,,,,,,,,,,,, ,,,,,,,,,,,,,,,,,,,,
Austria,Tirol,,10,10,Christmas parties with max 10 people from up to 10 households permitted,24 December 2020,"From ordinance: ""(7) On December 24th and 25th, 2020:... Notwithstanding Section 13, Paragraph 3, Item 10, meetings of no more than ten people are permitted, although these may come from a maximum of ten different households"". From government website: ""At private Christmas parties on 24 . and 25 . December allowed 10 people  to come together""",https://www.ris.bka.gv.at/Dokumente/BgblAuth/BGBLA_2020_II_566/BGBLA_2020_II_566.html https://web.archive.org/web/20201222220659/https://www.sozialministerium.at/Informationen-zum-Coronavirus/Coronavirus---Aktuelle-Ma%C3%9Fnahmen.html,25 December 2020,"""§ 12. (1) Leaving your own private living area and staying outside your own private living area for the purpose of participating in events is only permitted for the following events [long ish list follows]""",https://web.archive.org/web/20201229144455/https://www.sozialministerium.at/Informationen-zum-Coronavirus/Coronavirus---Aktuelle-Ma%C3%9Fnahmen.html https://www.ris.bka.gv.at/Dokumente/BgblAuth/BGBLA_2020_II_598/BGBLA_2020_II_598.html, ,10,10,Christmas parties with max 10 people from up to 10 households permitted,24 December 2020,"From ordinance: ""(7) On December 24th and 25th, 2020:... Notwithstanding Section 13, Paragraph 3, Item 10, meetings of no more than ten people are permitted, although these may come from a maximum of ten different households"". From government website: ""At private Christmas parties on 24 . and 25 . December allowed 10 people  to come together""",https://www.ris.bka.gv.at/Dokumente/BgblAuth/BGBLA_2020_II_566/BGBLA_2020_II_566.html https://web.archive.org/web/20201222220659/https://www.sozialministerium.at/Informationen-zum-Coronavirus/Coronavirus---Aktuelle-Ma%C3%9Fnahmen.html,25 December 2020,"""§ 12. (1) Leaving your own private living area and staying outside your own private living area for the purpose of participating in events is only permitted for the following events [long ish list follows]""",https://web.archive.org/web/20201229144455/https://www.sozialministerium.at/Informationen-zum-Coronavirus/Coronavirus---Aktuelle-Ma%C3%9Fnahmen.html https://www.ris.bka.gv.at/Dokumente/BgblAuth/BGBLA_2020_II_598/BGBLA_2020_II_598.html, ,10,10,Christmas parties with max 10 people from up to 10 households permitted,24 December 2020,"From ordinance: ""(7) On December 24th and 25th, 2020:... Notwithstanding Section 13, Paragraph 3, Item 10, meetings of no more than ten people are permitted, although these may come from a maximum of ten different households"". From government website: ""At private Christmas parties on 24 . and 25 . December allowed 10 people  to come together""",https://www.ris.bka.gv.at/Dokumente/BgblAuth/BGBLA_2020_II_566/BGBLA_2020_II_566.html https://web.archive.org/web/20201222220659/https://www.sozialministerium.at/Informationen-zum-Coronavirus/Coronavirus---Aktuelle-Ma%C3%9Fnahmen.html,25 December 2020,"""§ 12. (1) Leaving your own private living area and staying outside your own private living area for the purpose of participating in events is only permitted for the following events [long ish list follows]""",https://web.archive.org/web/20201229144455/https://www.sozialministerium.at/Informationen-zum-Coronavirus/Coronavirus---Aktuelle-Ma%C3%9Fnahmen.html https://www.ris.bka.gv.at/Dokumente/BgblAuth/BGBLA_2020_II_598/BGBLA_2020_II_598.html, ,,,,,,,,,,,,,,,,,,,,,,,,,,,,,,,,,,,,,,,,,,,,,,,,,,,,,,,,,,,,,,,,,,,,,,,,,,,, ,,,,,,,,,,,,,,,,,,,,
Austria,Tirol,,1,1,Meeting people is generally prohibited,26 December 2020,"""§ 12. (1) Leaving your own private living area and staying outside your own private living area for the purpose of participating in events is only permitted for the following events: [long ish list follows]""",https://web.archive.org/web/20201229144455/https://www.sozialministerium.at/Informationen-zum-Coronavirus/Coronavirus---Aktuelle-Ma%C3%9Fnahmen.html https://www.ris.bka.gv.at/Dokumente/BgblAuth/BGBLA_2020_II_598/BGBLA_2020_II_598.html,no,"Advice on government website appears unchanged since 2020/12/26, as of today (2021/01/12). Also ordinance that came into force on 2020/12/26 was amended such that it was extended to run until 2021/01/14.",Archived government advice page: https://archive.vn/dXePU. old ordinance: https://www.ris.bka.gv.at/Dokumente/BgblAuth/BGBLA_2020_II_598/BGBLA_2020_II_598.html. amendment to extend old ordinance: https://www.ris.bka.gv.at/Dokumente/BgblAuth/BGBLA_2021_II_2/BGBLA_2021_II_2.html, ,1,1,Meeting people is generally prohibited,26 December 2020,"""§ 12. (1) Leaving your own private living area and staying outside your own private living area for the purpose of participating in events is only permitted for the following events: [long ish list follows]""",https://web.archive.org/web/20201229144455/https://www.sozialministerium.at/Informationen-zum-Coronavirus/Coronavirus---Aktuelle-Ma%C3%9Fnahmen.html https://www.ris.bka.gv.at/Dokumente/BgblAuth/BGBLA_2020_II_598/BGBLA_2020_II_598.html,no,"Advice on government website appears unchanged since 2020/12/26, as of today (2021/01/12). Also ordinance that came into force on 2020/12/26 was amended such that it was extended to run until 2021/01/14.",Archived government advice page: https://archive.vn/dXePU. old ordinance: https://www.ris.bka.gv.at/Dokumente/BgblAuth/BGBLA_2020_II_598/BGBLA_2020_II_598.html. amendment to extend old ordinance: https://www.ris.bka.gv.at/Dokumente/BgblAuth/BGBLA_2021_II_2/BGBLA_2021_II_2.html, ,1,1,Meeting people is generally prohibited,26 December 2020,"""§ 12. (1) Leaving your own private living area and staying outside your own private living area for the purpose of participating in events is only permitted for the following events: [long ish list follows]""",https://web.archive.org/web/20201229144455/https://www.sozialministerium.at/Informationen-zum-Coronavirus/Coronavirus---Aktuelle-Ma%C3%9Fnahmen.html https://www.ris.bka.gv.at/Dokumente/BgblAuth/BGBLA_2020_II_598/BGBLA_2020_II_598.html,no,"Advice on government website appears unchanged since 2020/12/26, as of today (2021/01/12). Also ordinance that came into force on 2020/12/26 was amended such that it was extended to run until 2021/01/14.",Archived government advice page: https://archive.vn/dXePU. old ordinance: https://www.ris.bka.gv.at/Dokumente/BgblAuth/BGBLA_2020_II_598/BGBLA_2020_II_598.html. amendment to extend old ordinance: https://www.ris.bka.gv.at/Dokumente/BgblAuth/BGBLA_2021_II_2/BGBLA_2021_II_2.html, ,,,,,,,,,,,,,,,,,,,,,,,,,,,,,,,,,,,,,,,,,,,,,,,,,,,,,,,,,,,,,,,,,,,,,,,,,,,, ,,,,,,,,,,,,,,,,,,,,
,,,,,,,,,,,,,,,,,,,,,,,,,,,,,,,,,,,,,,,,,,,,,,,,,,,,,,,,,,,,,,,,,,,,,,,,,,,,,,,,,,,,,,,,,,,,,,,,,,,,,,,,,,,,,,,,,,,,,,,,,,,,,,,,
